{"network_collection_contract":{"backoff":"deterministic exponential: 1000ms, 2000ms","checkpoint_resume":true,"datum_policy":"WGS-84 only; unknown/GCJ-02/BD-09 rejected","outcome_enum":["complete","missing","blocked","rate_limited","transport_error","invalid_response"],"overpass_endpoint":"https://overpass-api.de/api/interpreter","retry_limit":2,"source_independence_rule":"Wikidata and Wikipedia count as one lineage","timeout_ms":120000,"user_agent":"PeakTrekker-T13-coordinate-audit/1.0 (data engineering; contact via repository)"},"population_binding_sha256":"adba90fa895b3acabbc58bb3057c20425b0444c325eda4f7dc9059f776af8a9f","requests":[{"adapter_version":"cop-dem-glo30-v1","cache_hit":true,"effective_canonical_key":"bogeda-feng","fetched_at":"2026-07-25T21:16:55.156Z","http_status":200,"normalized_request_params":{"candidate_latitude":43.793232,"candidate_longitude":88.344441,"endpoint":"https://copernicus-dem-30m.s3.amazonaws.com/Copernicus_DSM_COG_10_N43_00_E088_00_DEM/Copernicus_DSM_COG_10_N43_00_E088_00_DEM.tif","method":"GET","radius_m":300,"tile_id":"Copernicus_DSM_COG_10_N43_00_E088_00_DEM"},"outcome":"complete","outcome_reason":null,"parsed_output_cas_path":"source-cache/sha256/6b9554a7b1a6a0a41d457f4419fc3a5635f986b0aa67bf972dcb8e0a9f543c2b","parsed_output_hash":"6b9554a7b1a6a0a41d457f4419fc3a5635f986b0aa67bf972dcb8e0a9f543c2b","rate_limit_signal":false,"request_hash":"53781b9566ea861a079b729040d079aaa0c2d46544e04e0a659ddc8b14b2a48d","request_id":"dem-pilot:bogeda-feng:cop-dem-glo30","response_cas_path":"source-cache/sha256/3c7061f89afb8152c82ee0074beae43f61578c9006aabacdd2e87d79447ecab1","response_hash":"3c7061f89afb8152c82ee0074beae43f61578c9006aabacdd2e87d79447ecab1","source_family":"cop-dem-glo30","source_license":{"attribution_required":true,"license_id":"COP-DEM-GLO-30-FULL-FREE-OPEN","license_url":"https://dataspace.copernicus.eu/explore-data/data-collections/copernicus-contributing-missions/collections-description/COP-DEM"}},{"adapter_version":"esa-worldcover-2021-v1","cache_hit":true,"effective_canonical_key":"bogeda-feng","fetched_at":"2026-07-25T21:16:55.348Z","http_status":200,"normalized_request_params":{"candidate_latitude":43.793232,"candidate_longitude":88.344441,"endpoint":"https://esa-worldcover.s3.eu-central-1.amazonaws.com/v200/2021/map/ESA_WorldCover_10m_2021_v200_N42E087_Map.tif","ledger_altitude_m":5445,"method":"GET","radius_m":300,"tile_id":"ESA_WorldCover_10m_2021_v200_N42E087_Map"},"outcome":"complete","outcome_reason":null,"parsed_output_cas_path":"source-cache/sha256/9365dac761c0849a6cde1214d8d7b14d0bce8ae572cc51d55be0b395e38e8770","parsed_output_hash":"9365dac761c0849a6cde1214d8d7b14d0bce8ae572cc51d55be0b395e38e8770","rate_limit_signal":false,"request_hash":"abacffbb054cfe95acb36b05f9c01534459a69ed06dd8af0b9b0befa92e940ec","request_id":"dem-pilot:bogeda-feng:esa-worldcover","response_cas_path":"source-cache/sha256/683f1c50e0f7d6c4a3960a51bc04b29fd0719e65e4a34626e81750cc6f54b90c","response_hash":"683f1c50e0f7d6c4a3960a51bc04b29fd0719e65e4a34626e81750cc6f54b90c","source_family":"esa-worldcover","source_license":{"attribution_required":true,"license_id":"CC-BY-4.0","license_url":"https://esa-worldcover.org/en/data-access"}},{"adapter_version":"cop-dem-glo30-v1","cache_hit":true,"effective_canonical_key":"broad-peak","fetched_at":"2026-07-25T21:16:55.473Z","http_status":200,"normalized_request_params":{"candidate_latitude":35.810927,"candidate_longitude":76.568086,"endpoint":"https://copernicus-dem-30m.s3.amazonaws.com/Copernicus_DSM_COG_10_N35_00_E076_00_DEM/Copernicus_DSM_COG_10_N35_00_E076_00_DEM.tif","method":"GET","radius_m":300,"tile_id":"Copernicus_DSM_COG_10_N35_00_E076_00_DEM"},"outcome":"complete","outcome_reason":null,"parsed_output_cas_path":"source-cache/sha256/8358f8b50cd55101a72ac0e329083b3b87318c821e4cfd9a3b53dc23eaf00625","parsed_output_hash":"8358f8b50cd55101a72ac0e329083b3b87318c821e4cfd9a3b53dc23eaf00625","rate_limit_signal":false,"request_hash":"d62c36bc5e3b14a3119aa96d6054709c2d7f9b7e0b1cd91c0b637375ff2e3414","request_id":"dem-pilot:broad-peak:cop-dem-glo30","response_cas_path":"source-cache/sha256/362c08afd374afb88ac380a34b3ac3536e750f2d339d259075f01e659073473f","response_hash":"362c08afd374afb88ac380a34b3ac3536e750f2d339d259075f01e659073473f","source_family":"cop-dem-glo30","source_license":{"attribution_required":true,"license_id":"COP-DEM-GLO-30-FULL-FREE-OPEN","license_url":"https://dataspace.copernicus.eu/explore-data/data-collections/copernicus-contributing-missions/collections-description/COP-DEM"}},{"adapter_version":"esa-worldcover-2021-v1","cache_hit":true,"effective_canonical_key":"broad-peak","fetched_at":"2026-07-25T21:16:55.669Z","http_status":200,"normalized_request_params":{"candidate_latitude":35.810927,"candidate_longitude":76.568086,"endpoint":"https://esa-worldcover.s3.eu-central-1.amazonaws.com/v200/2021/map/ESA_WorldCover_10m_2021_v200_N33E075_Map.tif","ledger_altitude_m":8051,"method":"GET","radius_m":300,"tile_id":"ESA_WorldCover_10m_2021_v200_N33E075_Map"},"outcome":"complete","outcome_reason":null,"parsed_output_cas_path":"source-cache/sha256/e5b09ad95ddf34eb11c80bd7227fe3b9e3528121b2170d8379b10a1c8e4f68ee","parsed_output_hash":"e5b09ad95ddf34eb11c80bd7227fe3b9e3528121b2170d8379b10a1c8e4f68ee","rate_limit_signal":false,"request_hash":"cb73c802b539559b11a18cc8c26916572e0bb47f2e2897d373e566cc9ba649cc","request_id":"dem-pilot:broad-peak:esa-worldcover","response_cas_path":"source-cache/sha256/1cb5803cbedb29c319a0b9c0720e957454f482f5f309fd59ba34db8c69e0d7e4","response_hash":"1cb5803cbedb29c319a0b9c0720e957454f482f5f309fd59ba34db8c69e0d7e4","source_family":"esa-worldcover","source_license":{"attribution_required":true,"license_id":"CC-BY-4.0","license_url":"https://esa-worldcover.org/en/data-access"}},{"adapter_version":"cop-dem-glo30-v1","cache_hit":true,"effective_canonical_key":"kawagebo","fetched_at":"2026-07-25T21:16:55.805Z","http_status":200,"normalized_request_params":{"candidate_latitude":28.440043,"candidate_longitude":98.687263,"endpoint":"https://copernicus-dem-30m.s3.amazonaws.com/Copernicus_DSM_COG_10_N28_00_E098_00_DEM/Copernicus_DSM_COG_10_N28_00_E098_00_DEM.tif","method":"GET","radius_m":300,"tile_id":"Copernicus_DSM_COG_10_N28_00_E098_00_DEM"},"outcome":"complete","outcome_reason":null,"parsed_output_cas_path":"source-cache/sha256/97d9f6bd6f7324aae8da1a9b74633aeb60986494df45bb4a6f61eb452599924b","parsed_output_hash":"97d9f6bd6f7324aae8da1a9b74633aeb60986494df45bb4a6f61eb452599924b","rate_limit_signal":false,"request_hash":"78746fa9f770e7750ea69447706a028a3cc52edd6e1d74dab85c60bc51976369","request_id":"dem-pilot:kawagebo:cop-dem-glo30","response_cas_path":"source-cache/sha256/2e2a8b877dbf30aae1c345b4c00f23bec4518bae77890bfc9310ad5214b357ae","response_hash":"2e2a8b877dbf30aae1c345b4c00f23bec4518bae77890bfc9310ad5214b357ae","source_family":"cop-dem-glo30","source_license":{"attribution_required":true,"license_id":"COP-DEM-GLO-30-FULL-FREE-OPEN","license_url":"https://dataspace.copernicus.eu/explore-data/data-collections/copernicus-contributing-missions/collections-description/COP-DEM"}},{"adapter_version":"esa-worldcover-2021-v1","cache_hit":true,"effective_canonical_key":"kawagebo","fetched_at":"2026-07-25T21:16:55.934Z","http_status":200,"normalized_request_params":{"candidate_latitude":28.440043,"candidate_longitude":98.687263,"endpoint":"https://esa-worldcover.s3.eu-central-1.amazonaws.com/v200/2021/map/ESA_WorldCover_10m_2021_v200_N27E096_Map.tif","ledger_altitude_m":null,"method":"GET","radius_m":300,"tile_id":"ESA_WorldCover_10m_2021_v200_N27E096_Map"},"outcome":"complete","outcome_reason":null,"parsed_output_cas_path":"source-cache/sha256/c430ed5be00b0b31a8ff3356ca26effaa2f817c6406c78eb7a86d6c1fdc06ce4","parsed_output_hash":"c430ed5be00b0b31a8ff3356ca26effaa2f817c6406c78eb7a86d6c1fdc06ce4","rate_limit_signal":false,"request_hash":"0f8e743401835e9d331c5e33d19e730582fbf69584185750a9ec96ad20388c8f","request_id":"dem-pilot:kawagebo:esa-worldcover","response_cas_path":"source-cache/sha256/fad67c5665b16eb8eb9a580ed56c226c87b215d97f829f44f4511279981a8ff4","response_hash":"fad67c5665b16eb8eb9a580ed56c226c87b215d97f829f44f4511279981a8ff4","source_family":"esa-worldcover","source_license":{"attribution_required":true,"license_id":"CC-BY-4.0","license_url":"https://esa-worldcover.org/en/data-access"}},{"adapter_version":"cop-dem-glo30-v1","cache_hit":true,"effective_canonical_key":"kongur-jiubie-feng","fetched_at":"2026-07-25T21:16:56.064Z","http_status":200,"normalized_request_params":{"candidate_latitude":38.666667,"candidate_longitude":75.166667,"endpoint":"https://copernicus-dem-30m.s3.amazonaws.com/Copernicus_DSM_COG_10_N38_00_E075_00_DEM/Copernicus_DSM_COG_10_N38_00_E075_00_DEM.tif","method":"GET","radius_m":300,"tile_id":"Copernicus_DSM_COG_10_N38_00_E075_00_DEM"},"outcome":"complete","outcome_reason":null,"parsed_output_cas_path":"source-cache/sha256/e04d8d655a07555a06ee116d1515ce41474dde3183e7f3021104f20ea8aaa8b7","parsed_output_hash":"e04d8d655a07555a06ee116d1515ce41474dde3183e7f3021104f20ea8aaa8b7","rate_limit_signal":false,"request_hash":"76e981d7bd0da6a35895f31c6bad84845953defd9c2f6cdb04dbc310b7507816","request_id":"dem-pilot:kongur-jiubie-feng:cop-dem-glo30","response_cas_path":"source-cache/sha256/ca81e041c68120947c8f3ec54af4a696457859e6aa0828a39d06f68501a5ce18","response_hash":"ca81e041c68120947c8f3ec54af4a696457859e6aa0828a39d06f68501a5ce18","source_family":"cop-dem-glo30","source_license":{"attribution_required":true,"license_id":"COP-DEM-GLO-30-FULL-FREE-OPEN","license_url":"https://dataspace.copernicus.eu/explore-data/data-collections/copernicus-contributing-missions/collections-description/COP-DEM"}},{"adapter_version":"esa-worldcover-2021-v1","cache_hit":true,"effective_canonical_key":"kongur-jiubie-feng","fetched_at":"2026-07-25T21:16:56.188Z","http_status":200,"normalized_request_params":{"candidate_latitude":38.666667,"candidate_longitude":75.166667,"endpoint":"https://esa-worldcover.s3.eu-cent